scenario_key,module,title,scene,customer_psychology,common_mistakes,strategy,scripts,follow_up_questions,next_action,risk_note,applicable_roles,applicable_stages,source,tags
"price_sensitive_type","客户分型","价格敏感型客户","客户反复比价、追问优惠、对价格高度关注","价格敏感型客户的核心不一定是没钱，而是把花得值不值看得很重，对价格有强心理账户边界。识别特征：开口问价、反复砍价、爱比较、对优惠敏感。她的决策由是否占到便宜和是否划算驱动。硬碰硬谈价格会陷入拉锯，正确方向是把她的注意力从价格维度引到价值与适配维度，并用低门槛和确定性降低她对花亏了的恐惧。","1) 被她带着不断让价——陷入价格拉锯，越让越不值钱；2) 直接说我们不贵——把战场留在价格维度；3) 忽视她对划算的心理需求硬讲高端——话不投机。","底层逻辑：承认她对划算的在意，但把划算重新定义为适配和不浪费，而非绝对低价。三步：1) 认同她精打细算是对的——先共情不对立；2) 把划算重构为买对比买便宜更省钱（买了不适合的才是浪费）；3) 用低门槛体验给她可控的试错——满足她对确定性的需求。","（范例，需结合客户画像改写）姐您会算账是好事，护肤这钱更要花在刀刃上。与其图便宜买了不适合的，不如先花小钱体验一次，确认真适合您再投入，这样才不浪费。","您之前有没有买过觉得不划算的护肤项目？；如果确认适合您，您比较能接受的预算大概在哪？","把价格话题引向适配价值，给低门槛体验，记录预算心理边界","不得虚标原价或夸大优惠，价格让步需升级","consultant,reception","new,intent","行为经济学心理账户与锚定效应 + DISC 行为风格；美业场景应用推演","客户分型,价格敏感,异议处理"
"quality_focused_type","客户分型","品质效果导向型客户","客户不太在意价格，更关注效果、专业度和品质","品质导向型客户处于较高消费层级，价格不是主要顾虑，她最怕的是不专业、没效果、浪费时间。识别特征：问原理、问资质、问案例，对价格不敏感但对细节挑剔。她的决策由专业可信度和效果确定性驱动。对这类客户讲优惠、讲便宜是减分的，会拉低你的专业档次。正确方向是用专业、权威、品质和确定性赢得她，价格反而不必多谈。","1) 一上来就讲优惠便宜——拉低专业感，反而让她怀疑品质；2) 回答不够专业、含糊其辞——直接出局；3) 过度热情推销——让追求品质的客户觉得廉价。","底层逻辑：用专业权威和品质细节建立信任，弱化价格、强化确定性。三步：1) 展现专业（讲原理、讲方案逻辑、讲为什么适合她）——建立权威可信（Cialdini 权威原则）；2) 用细节和规范体现品质——满足她对高标准的要求；3) 给可验证的确定性（体验、记录、对比）——回应她对效果的核心关注。","（范例，需结合客户画像改写）看得出您对品质很有要求。我先不跟您谈价格，咱们先说专业的：您这个肤况，我建议的方案逻辑是这样的……您可以先体验一次，亲自感受我们的仪器和手法的专业度，再决定值不值得长期交给我们。","您之前在护肤上最看重的是效果、体验还是安全？；有没有遇到过让您觉得不够专业的经历？","用专业和品质细节建立信任，给可验证体验，弱化价格话题","不得为显专业而夸大功效或承诺疗效，资质宣称须真实","consultant,beautician","intent,regular,deal","Cialdini《影响力》权威原则 + 马斯洛需求层次（尊重与自我实现）+ DISC；美业场景应用推演","客户分型,品质导向,高客单"
"hesitant_type","客户分型","犹豫纠结型客户","客户对什么都说再想想、难以下决定","犹豫型客户的本质是决策瘫痪——选项太多、信息太杂、怕做错决定，导致迟迟不行动（选择过载）。叠加损失厌恶，她对做错的恐惧大于行动的收益，于是用拖延来回避决策压力。识别特征：反复问、反复比、说再看看、容易被新信息动摇。对她不能给更多选项（加重瘫痪），而要帮她做减法、降低单次决策的分量。","1) 给一堆方案让她选——选项越多越瘫痪，越不定；2) 反复催促施压——加重她的决策焦虑，更想逃；3) 抛大量信息想说服——信息过载，反而更乱。","底层逻辑：帮她做减法、把大决策拆成零风险小决策，降低决策压力。三步：1) 替她收敛选项——直接给一个最适合的建议，而不是一堆选择；2) 把决定拆小（先体验一次而非先定疗程）——降低单次决策分量；3) 给明确的、低风险的下一步动作——用确定性对冲她的怕做错。","（范例，需结合客户画像改写）姐我看您也比较了不少，其实不用纠结那么多。按您的情况，我就推荐这一个最合适的，您也别想着一步到位，先花小钱体验一次，觉得好咱再继续，不好也没损失，这样最省心。","您现在最纠结的其实是哪一点？；如果我直接帮您定一个最稳妥的，您愿意先试一次吗？","替客户收敛选项给单一建议，把决策拆小，给低风险下一步","不得利用其犹豫强行逼单，不得制造焦虑","consultant","new,intent","选择过载理论(choice overload) + 损失厌恶 + 决策简化；美业场景应用推演","客户分型,犹豫客户,成交推进"
"decisive_type","客户分型","果断强势型客户","客户主导性强、节奏快、不喜欢绕弯子","果断强势型客户（DISC 中的 D 型）掌控欲强、效率优先、讨厌被绕和被推销。识别特征：说话直接、节奏快、自己拿主意、不耐烦寒暄。她的决策由我说了算和高效务实驱动。对她啰嗦铺垫、绕弯子、过度热情都会让她不耐烦。正确方向是干脆、专业、给选择权，让她感到一切尽在她掌控，反而成交快。","1) 长篇铺垫、绕弯子——她没耐心，直接失去兴趣；2) 替她做决定、强势推销——和她的掌控欲正面冲突，激起对抗；3) 过度热情寒暄——她觉得你不专业、在浪费她时间。","底层逻辑：干脆直接、给足专业和选择权，让她在掌控感中快速决策。三步：1) 开门见山给专业结论——尊重她的效率，不绕；2) 给二选一而非开放问题——既高效又把决定权留给她；3) 不强推、点到为止——把球干脆地交到她手里。","（范例，需结合客户画像改写）姐我直接说重点：您这个情况，补水修复最对症，我建议先做一次体验确认效果。您看是今天下午还是明天上午方便，我直接帮您约上。","您是想先体验确认效果，还是直接按方案安排？；今天还是明天到店方便？","开门见山给专业建议，用二选一推进，把决定权交给客户","不得为迎合其果断而省略风险提示与合规说明","consultant,reception","new,intent,deal","DISC 行为风格(D 型支配型) + Chris Voss 谈判中的掌控感设计；美业场景应用推演","客户分型,强势客户,高效成交"
"social_type","客户分型","社交关系型客户","客户健谈、重感情、看重和你的关系与口碑","社交关系型客户（DISC 中的 I 型）感性、重关系、爱聊天、易受他人影响。识别特征：话多、热情、爱问别人做得怎么样、容易被氛围和口碑带动。她的决策由喜欢你、信任你和别人都说好驱动（社会认同 + 喜好原则），而非冷冰冰的参数。对她讲一堆专业参数是低效的，建立个人关系和提供社会认同才是关键。","1) 只讲专业参数、公事公办——和她的感性诉求错频，打动不了；2) 忽视关系经营、只想快速成交——她要的是被当朋友；3) 不给社会认同（别人的口碑案例）——少了她最看重的决策依据。","底层逻辑：先建立个人关系和好感，再用社会认同（口碑、案例、其他客户）推动决策。三步：1) 投入关系经营、真诚互动——喜好原则，她信任喜欢的人；2) 用真实客户口碑和案例佐证——社会认同，别人都说好对她权重高；3) 顺着关系自然推进、不功利——让成交像朋友推荐。","（范例，需结合客户画像改写）姐跟您聊天真舒服。其实跟您情况差不多的好几位老客，做这个补水都挺满意的，回头还带朋友来。我也是觉得真适合您才跟您说，您要有兴趣咱先体验一次感受下。","您身边有没有也在做护肤的朋友？；您比较信任什么样的推荐？","投入关系经营，用真实口碑案例佐证，顺关系自然推进","社会认同须用真实案例，不得编造客户口碑，不得承诺疗效","consultant,reception","new,intent,regular","DISC 行为风格(I 型影响型) + Cialdini 社会认同与喜好原则；美业场景应用推演","客户分型,社交客户,口碑转化"
